AreaID,ManagedAreaName,ParameterName,RelativeDepth,ActivityType,N_Total,N_AnalysisUse,N_H,perc_H,N_I,perc_I,N_Q,perc_Q,N_S,perc_S,N_U,perc_U
4,Banana River Aquatic Preserve,Chlorophyll a uncorrected for pheophytin,Bottom,Field,1,0,0,0,0,0,0,0,0,0,0,0
5,Big Bend Seagrasses Aquatic Preserve,Chlorophyll a uncorrected for pheophytin,Bottom,Field,15,15,0,0,0,0,0,0,0,0,0,0
15,Florida Keys National Marine Sanctuary,Chlorophyll a uncorrected for pheophytin,Bottom,Field,260,260,0,0,0,0,0,0,0,0,0,0
17,Fort Pickens State Park Aquatic Preserve,Chlorophyll a uncorrected for pheophytin,Bottom,Field,4,0,0,0,0,0,0,0,0,0,0,0
21,Indian River-Malabar to Vero Beach Aquatic Preserve,Chlorophyll a uncorrected for pheophytin,Bottom,Field,1,0,0,0,0,0,0,0,0,0,0,0
48,Nature Coast Aquatic Preserve,Chlorophyll a uncorrected for pheophytin,Bottom,Field,3,0,0,0,0,0,0,0,0,0,0,0
35,Pinellas County Aquatic Preserve,Chlorophyll a uncorrected for pheophytin,Bottom,Field,165,165,0,0,0,0,0,0,0,0,0,0
41,St. Joseph Bay Aquatic Preserve,Chlorophyll a uncorrected for pheophytin,Bottom,Field,3,0,0,0,0,0,0,0,0,0,0,0
