AreaID,ManagedAreaName,ParameterName,RelativeDepth,ActivityType,N_Total,N_AnalysisUse,N_H,perc_H,N_I,perc_I,N_Q,perc_Q,N_S,perc_S,N_U,perc_U
1,Alligator Harbor Aquatic Preserve,Dissolved Oxygen,Bottom,Field,2394,2394,0,0,0,0,0,0,0,0,0,0
2,Apalachicola Bay Aquatic Preserve,Dissolved Oxygen,Bottom,Field,11543,11543,0,0,0,0,0,0,0,0,0,0
3,Apalachicola National Estuarine Research Reserve,Dissolved Oxygen,Bottom,Field,16348,16348,0,0,0,0,0,0,0,0,0,0
4,Banana River Aquatic Preserve,Dissolved Oxygen,Bottom,Field,5719,5719,0,0,0,0,0,0,0,0,0,0
5,Big Bend Seagrasses Aquatic Preserve,Dissolved Oxygen,Bottom,Field,31316,31316,0,0,0,0,0,0,0,0,0,0
7,Biscayne Bay-Cape Florida to Monroe County Line Aquatic Preserve,Dissolved Oxygen,Bottom,Field,1,0,0,0,0,0,0,0,0,0,0,0
6,Biscayne Bay Aquatic Preserve,Dissolved Oxygen,Bottom,Field,1802,1802,0,0,0,0,0,0,0,0,0,0
8,Boca Ciega Bay Aquatic Preserve,Dissolved Oxygen,Bottom,Field,6160,6160,0,0,0,0,0,0,0,0,0,0
9,Cape Haze Aquatic Preserve,Dissolved Oxygen,Bottom,Field,605,605,0,0,0,0,0,0,0,0,0,0
10,Cape Romano-Ten Thousand Islands Aquatic Preserve,Dissolved Oxygen,Bottom,Field,4715,4715,0,0,0,0,0,0,0,0,0,0
11,Cockroach Bay Aquatic Preserve,Dissolved Oxygen,Bottom,Field,3854,3854,0,0,0,0,0,0,0,0,0,0
13,Coupon Bight Aquatic Preserve,Dissolved Oxygen,Bottom,Field,51,51,0,0,0,0,0,0,0,0,0,0
14,Estero Bay Aquatic Preserve,Dissolved Oxygen,Bottom,Field,412,412,0,0,0,0,0,0,0,0,0,0
15,Florida Keys National Marine Sanctuary,Dissolved Oxygen,Bottom,Field,15592,15592,0,0,0,0,0,0,0,0,0,0
16,Fort Clinch State Park Aquatic Preserve,Dissolved Oxygen,Bottom,Field,15,0,0,0,0,0,0,0,0,0,0,0
17,Fort Pickens State Park Aquatic Preserve,Dissolved Oxygen,Bottom,Field,19,19,0,0,0,0,0,0,0,0,0,0
18,Gasparilla Sound-Charlotte Harbor Aquatic Preserve,Dissolved Oxygen,Bottom,Field,3978,3978,0,0,0,0,0,0,0,0,0,0
19,Guana River Marsh Aquatic Preserve,Dissolved Oxygen,Bottom,Field,2162,2162,0,0,0,0,0,0,0,0,0,0
20,Guana Tolomato Matanzas National Estuarine Research Reserve,Dissolved Oxygen,Bottom,Field,5490,5490,0,0,0,0,0,0,0,0,0,0
21,Indian River-Malabar to Vero Beach Aquatic Preserve,Dissolved Oxygen,Bottom,Field,9367,9367,0,0,0,0,0,0,0,0,0,0
22,Indian River-Vero Beach to Ft. Pierce Aquatic Preserve,Dissolved Oxygen,Bottom,Field,1973,1973,0,0,0,0,0,0,0,0,0,0
23,Jensen Beach to Jupiter Inlet Aquatic Preserve,Dissolved Oxygen,Bottom,Field,282,282,0,0,0,0,0,0,0,0,0,0
24,Lake Jackson Aquatic Preserve,Dissolved Oxygen,Bottom,Field,1,0,0,0,0,0,0,0,0,0,0,0
25,Lemon Bay Aquatic Preserve,Dissolved Oxygen,Bottom,Field,1825,1825,0,0,0,0,0,0,0,0,0,0
26,Lignumvitae Key Aquatic Preserve,Dissolved Oxygen,Bottom,Field,62,0,0,0,0,0,0,0,0,0,0,0
27,Loxahatchee River-Lake Worth Creek Aquatic Preserve,Dissolved Oxygen,Bottom,Field,370,370,0,0,0,0,0,0,0,0,0,0
28,Matlacha Pass Aquatic Preserve,Dissolved Oxygen,Bottom,Field,720,720,0,0,0,0,0,0,0,0,0,0
29,Mosquito Lagoon Aquatic Preserve,Dissolved Oxygen,Bottom,Field,1093,1093,0,0,0,0,0,0,0,0,0,0
30,Nassau River-St. Johns River Marshes Aquatic Preserve,Dissolved Oxygen,Bottom,Field,372,372,0,0,0,0,0,0,0,0,0,0
48,Nature Coast Aquatic Preserve,Dissolved Oxygen,Bottom,Field,850,850,0,0,0,0,0,0,0,0,0,0
31,North Fork St. Lucie Aquatic Preserve,Dissolved Oxygen,Bottom,Field,21,0,0,0,0,0,0,0,0,0,0,0
32,Oklawaha River Aquatic Preserve,Dissolved Oxygen,Bottom,Field,1,0,0,0,0,0,0,0,0,0,0,0
33,Pellicer Creek Aquatic Preserve,Dissolved Oxygen,Bottom,Field,54,0,0,0,0,0,0,0,0,0,0,0
34,Pine Island Sound Aquatic Preserve,Dissolved Oxygen,Bottom,Field,2345,2345,0,0,0,0,0,0,0,0,0,0
35,Pinellas County Aquatic Preserve,Dissolved Oxygen,Bottom,Field,16244,16244,0,0,0,0,0,0,0,0,0,0
36,Rainbow Springs Aquatic Preserve,Dissolved Oxygen,Bottom,Field,1,0,0,0,0,0,0,0,0,0,0,0
37,Rocky Bayou State Park Aquatic Preserve,Dissolved Oxygen,Bottom,Field,260,260,0,0,0,0,0,0,0,0,0,0
38,Rookery Bay Aquatic Preserve,Dissolved Oxygen,Bottom,Field,1643,1643,0,0,0,0,0,0,0,0,0,0
39,Rookery Bay National Estuarine Research Reserve,Dissolved Oxygen,Bottom,Field,6248,6248,0,0,0,0,0,0,0,0,0,0
12,Southeast Florida Coral Reef Ecosystem Conservation Area,Dissolved Oxygen,Bottom,Field,148,0,0,0,0,0,0,0,0,0,0,0
40,St. Andrews State Park Aquatic Preserve,Dissolved Oxygen,Bottom,Field,101,101,0,0,0,0,0,0,0,0,0,0
41,St. Joseph Bay Aquatic Preserve,Dissolved Oxygen,Bottom,Field,1782,1782,0,0,0,0,0,0,0,0,0,0
42,St. Joseph Bay State Buffer Preserve,Dissolved Oxygen,Bottom,Field,1,0,0,0,0,0,0,0,0,0,0,0
43,St. Martins Marsh Aquatic Preserve,Dissolved Oxygen,Bottom,Field,2667,2667,0,0,0,0,0,0,0,0,0,0
44,Terra Ceia Aquatic Preserve,Dissolved Oxygen,Bottom,Field,3227,3227,0,0,0,0,0,0,0,0,0,0
45,Tomoka Marsh Aquatic Preserve,Dissolved Oxygen,Bottom,Field,189,189,0,0,0,0,0,0,0,0,0,0
46,Wekiva River Aquatic Preserve,Dissolved Oxygen,Bottom,Field,1,0,0,0,0,0,0,0,0,0,0,0
47,Yellow River Marsh Aquatic Preserve,Dissolved Oxygen,Bottom,Field,328,328,0,0,0,0,0,0,0,0,0,0
