AreaID,ManagedAreaName,ParameterName,RelativeDepth,ActivityType,N_Total,N_Include,N_H,perc_H,N_I,perc_I,N_Q,perc_Q,N_S,perc_S,N_U,perc_U
1,Alligator Harbor Aquatic Preserve,Dissolved Oxygen Saturation,Bottom,Field,125,125,0,0,0,0,0,0,0,0,0,0
2,Apalachicola Bay Aquatic Preserve,Dissolved Oxygen Saturation,Bottom,Field,5785,5781,0,0,0,0,0,0,0,0,0,0
3,Apalachicola National Estuarine Research Reserve,Dissolved Oxygen Saturation,Bottom,Field,7268,7260,0,0,0,0,0,0,0,0,0,0
4,Banana River Aquatic Preserve,Dissolved Oxygen Saturation,Bottom,Field,6833,6821,0,0,0,0,0,0,0,0,0,0
5,Big Bend Seagrasses Aquatic Preserve,Dissolved Oxygen Saturation,Bottom,Field,903,874,0,0,0,0,0,0,0,0,0,0
6,Biscayne Bay Aquatic Preserve,Dissolved Oxygen Saturation,Bottom,Field,2642,2621,0,0,0,0,0,0,0,0,0,0
8,Boca Ciega Bay Aquatic Preserve,Dissolved Oxygen Saturation,Bottom,Field,7231,7227,0,0,0,0,0,0,0,0,0,0
9,Cape Haze Aquatic Preserve,Dissolved Oxygen Saturation,Bottom,Field,10,10,0,0,0,0,0,0,0,0,0,0
10,Cape Romano-Ten Thousand Islands Aquatic Preserve,Dissolved Oxygen Saturation,Bottom,Field,1118,1118,0,0,0,0,0,0,0,0,0,0
11,Cockroach Bay Aquatic Preserve,Dissolved Oxygen Saturation,Bottom,Field,9679,9399,0,0,0,0,0,0,0,0,0,0
13,Coupon Bight Aquatic Preserve,Dissolved Oxygen Saturation,Bottom,Field,130,130,0,0,0,0,0,0,0,0,0,0
14,Estero Bay Aquatic Preserve,Dissolved Oxygen Saturation,Bottom,Field,1213,1209,0,0,0,0,0,0,0,0,0,0
15,Florida Keys National Marine Sanctuary,Dissolved Oxygen Saturation,Bottom,Field,27900,27879,0,0,0,0,0,0,0,0,0,0
16,Fort Clinch State Park Aquatic Preserve,Dissolved Oxygen Saturation,Bottom,Field,52,50,0,0,0,0,0,0,0,0,0,0
17,Fort Pickens State Park Aquatic Preserve,Dissolved Oxygen Saturation,Bottom,Field,247,247,0,0,0,0,0,0,0,0,0,0
18,Gasparilla Sound-Charlotte Harbor Aquatic Preserve,Dissolved Oxygen Saturation,Bottom,Field,208,196,0,0,0,0,0,0,0,0,0,0
19,Guana River Marsh Aquatic Preserve,Dissolved Oxygen Saturation,Bottom,Field,998,980,0,0,0,0,0,0,0,0,0,0
20,Guana Tolomato Matanzas National Estuarine Research Reserve,Dissolved Oxygen Saturation,Bottom,Field,1890,1848,0,0,0,0,0,0,0,0,0,0
21,Indian River-Malabar to Vero Beach Aquatic Preserve,Dissolved Oxygen Saturation,Bottom,Field,11971,11964,0,0,0,0,0,0,0,0,0,0
22,Indian River-Vero Beach to Ft. Pierce Aquatic Preserve,Dissolved Oxygen Saturation,Bottom,Field,635,635,0,0,0,0,0,0,0,0,0,0
23,Jensen Beach to Jupiter Inlet Aquatic Preserve,Dissolved Oxygen Saturation,Bottom,Field,3944,3944,0,0,0,0,0,0,0,0,0,0
25,Lemon Bay Aquatic Preserve,Dissolved Oxygen Saturation,Bottom,Field,3901,3880,0,0,0,0,0,0,0,0,0,0
26,Lignumvitae Key Aquatic Preserve,Dissolved Oxygen Saturation,Bottom,Field,163,161,0,0,0,0,0,0,0,0,0,0
27,Loxahatchee River-Lake Worth Creek Aquatic Preserve,Dissolved Oxygen Saturation,Bottom,Field,7828,7828,0,0,0,0,0,0,0,0,0,0
28,Matlacha Pass Aquatic Preserve,Dissolved Oxygen Saturation,Bottom,Field,305,301,0,0,0,0,0,0,0,0,0,0
29,Mosquito Lagoon Aquatic Preserve,Dissolved Oxygen Saturation,Bottom,Field,274,272,0,0,0,0,0,0,0,0,0,0
30,Nassau River-St. Johns River Marshes Aquatic Preserve,Dissolved Oxygen Saturation,Bottom,Field,844,826,0,0,0,0,0,0,0,0,0,0
48,Nature Coast Aquatic Preserve,Dissolved Oxygen Saturation,Bottom,Field,621,621,0,0,0,0,0,0,0,0,0,0
31,North Fork St. Lucie Aquatic Preserve,Dissolved Oxygen Saturation,Bottom,Field,52,52,0,0,0,0,0,0,0,0,0,0
33,Pellicer Creek Aquatic Preserve,Dissolved Oxygen Saturation,Bottom,Field,165,156,0,0,0,0,0,0,0,0,0,0
34,Pine Island Sound Aquatic Preserve,Dissolved Oxygen Saturation,Bottom,Field,701,698,0,0,0,0,0,0,0,0,0,0
35,Pinellas County Aquatic Preserve,Dissolved Oxygen Saturation,Bottom,Field,26850,26385,0,0,0,0,0,0,0,0,0,0
37,Rocky Bayou State Park Aquatic Preserve,Dissolved Oxygen Saturation,Bottom,Field,592,592,0,0,0,0,0,0,0,0,0,0
38,Rookery Bay Aquatic Preserve,Dissolved Oxygen Saturation,Bottom,Field,865,865,0,0,0,0,0,0,0,0,0,0
39,Rookery Bay National Estuarine Research Reserve,Dissolved Oxygen Saturation,Bottom,Field,1995,1995,0,0,0,0,0,0,0,0,0,0
12,Southeast Florida Coral Reef Ecosystem Conservation Area,Dissolved Oxygen Saturation,Bottom,Field,166,166,0,0,0,0,0,0,0,0,0,0
40,St. Andrews State Park Aquatic Preserve,Dissolved Oxygen Saturation,Bottom,Field,245,234,0,0,0,0,0,0,0,0,0,0
41,St. Joseph Bay Aquatic Preserve,Dissolved Oxygen Saturation,Bottom,Field,278,274,0,0,0,0,0,0,0,0,0,0
43,St. Martins Marsh Aquatic Preserve,Dissolved Oxygen Saturation,Bottom,Field,81,80,0,0,0,0,0,0,0,0,0,0
44,Terra Ceia Aquatic Preserve,Dissolved Oxygen Saturation,Bottom,Field,4563,4371,0,0,0,0,0,0,0,0,0,0
45,Tomoka Marsh Aquatic Preserve,Dissolved Oxygen Saturation,Bottom,Field,186,184,0,0,0,0,0,0,0,0,0,0
47,Yellow River Marsh Aquatic Preserve,Dissolved Oxygen Saturation,Bottom,Field,102,100,0,0,0,0,0,0,0,0,0,0
