AreaID,ManagedAreaName,ParameterName,RelativeDepth,ActivityType,N_Total,N_AnalysisUse,N_H,perc_H,N_I,perc_I,N_Q,perc_Q,N_S,perc_S,N_U,perc_U
1,Alligator Harbor Aquatic Preserve,Total Nitrogen,Bottom,Lab,87,87,0,0,29,0.210129700746323,6,0.0434751104992392,0,0,88,0.637634953988841
2,Apalachicola Bay Aquatic Preserve,Total Nitrogen,Bottom,Lab,150,150,0,0,29,0.210129700746323,6,0.0434751104992392,0,0,88,0.637634953988841
3,Apalachicola National Estuarine Research Reserve,Total Nitrogen,Bottom,Lab,198,198,0,0,29,0.210129700746323,6,0.0434751104992392,0,0,88,0.637634953988841
4,Banana River Aquatic Preserve,Total Nitrogen,Bottom,Lab,87,0,0,0,29,0.210129700746323,6,0.0434751104992392,0,0,88,0.637634953988841
5,Big Bend Seagrasses Aquatic Preserve,Total Nitrogen,Bottom,Lab,206,206,0,0,29,0.210129700746323,6,0.0434751104992392,0,0,88,0.637634953988841
7,Biscayne Bay-Cape Florida to Monroe County Line Aquatic Preserve,Total Nitrogen,Bottom,Lab,1,0,0,0,29,0.210129700746323,6,0.0434751104992392,0,0,88,0.637634953988841
6,Biscayne Bay Aquatic Preserve,Total Nitrogen,Bottom,Lab,622,622,0,0,29,0.210129700746323,6,0.0434751104992392,0,0,88,0.637634953988841
8,Boca Ciega Bay Aquatic Preserve,Total Nitrogen,Bottom,Lab,4,0,0,0,29,0.210129700746323,6,0.0434751104992392,0,0,88,0.637634953988841
9,Cape Haze Aquatic Preserve,Total Nitrogen,Bottom,Lab,109,109,0,0,29,0.210129700746323,6,0.0434751104992392,0,0,88,0.637634953988841
10,Cape Romano-Ten Thousand Islands Aquatic Preserve,Total Nitrogen,Bottom,Lab,16,0,0,0,29,0.210129700746323,6,0.0434751104992392,0,0,88,0.637634953988841
11,Cockroach Bay Aquatic Preserve,Total Nitrogen,Bottom,Lab,6,0,0,0,29,0.210129700746323,6,0.0434751104992392,0,0,88,0.637634953988841
13,Coupon Bight Aquatic Preserve,Total Nitrogen,Bottom,Lab,1,0,0,0,29,0.210129700746323,6,0.0434751104992392,0,0,88,0.637634953988841
14,Estero Bay Aquatic Preserve,Total Nitrogen,Bottom,Lab,30,0,0,0,29,0.210129700746323,6,0.0434751104992392,0,0,88,0.637634953988841
15,Florida Keys National Marine Sanctuary,Total Nitrogen,Bottom,Lab,7745,7745,0,0,29,0.210129700746323,6,0.0434751104992392,0,0,88,0.637634953988841
16,Fort Clinch State Park Aquatic Preserve,Total Nitrogen,Bottom,Lab,1,0,0,0,29,0.210129700746323,6,0.0434751104992392,0,0,88,0.637634953988841
17,Fort Pickens State Park Aquatic Preserve,Total Nitrogen,Bottom,Lab,1,0,0,0,29,0.210129700746323,6,0.0434751104992392,0,0,88,0.637634953988841
18,Gasparilla Sound-Charlotte Harbor Aquatic Preserve,Total Nitrogen,Bottom,Lab,1193,1193,0,0,29,0.210129700746323,6,0.0434751104992392,0,0,88,0.637634953988841
19,Guana River Marsh Aquatic Preserve,Total Nitrogen,Bottom,Lab,296,296,0,0,29,0.210129700746323,6,0.0434751104992392,0,0,88,0.637634953988841
20,Guana Tolomato Matanzas National Estuarine Research Reserve,Total Nitrogen,Bottom,Lab,444,444,0,0,29,0.210129700746323,6,0.0434751104992392,0,0,88,0.637634953988841
21,Indian River-Malabar to Vero Beach Aquatic Preserve,Total Nitrogen,Bottom,Lab,242,242,0,0,29,0.210129700746323,6,0.0434751104992392,0,0,88,0.637634953988841
22,Indian River-Vero Beach to Ft. Pierce Aquatic Preserve,Total Nitrogen,Bottom,Lab,17,0,0,0,29,0.210129700746323,6,0.0434751104992392,0,0,88,0.637634953988841
23,Jensen Beach to Jupiter Inlet Aquatic Preserve,Total Nitrogen,Bottom,Lab,75,75,0,0,29,0.210129700746323,6,0.0434751104992392,0,0,88,0.637634953988841
25,Lemon Bay Aquatic Preserve,Total Nitrogen,Bottom,Lab,25,0,0,0,29,0.210129700746323,6,0.0434751104992392,0,0,88,0.637634953988841
26,Lignumvitae Key Aquatic Preserve,Total Nitrogen,Bottom,Lab,1,0,0,0,29,0.210129700746323,6,0.0434751104992392,0,0,88,0.637634953988841
27,Loxahatchee River-Lake Worth Creek Aquatic Preserve,Total Nitrogen,Bottom,Lab,771,771,0,0,29,0.210129700746323,6,0.0434751104992392,0,0,88,0.637634953988841
28,Matlacha Pass Aquatic Preserve,Total Nitrogen,Bottom,Lab,32,0,0,0,29,0.210129700746323,6,0.0434751104992392,0,0,88,0.637634953988841
29,Mosquito Lagoon Aquatic Preserve,Total Nitrogen,Bottom,Lab,81,81,0,0,29,0.210129700746323,6,0.0434751104992392,0,0,88,0.637634953988841
30,Nassau River-St. Johns River Marshes Aquatic Preserve,Total Nitrogen,Bottom,Lab,113,113,0,0,29,0.210129700746323,6,0.0434751104992392,0,0,88,0.637634953988841
48,Nature Coast Aquatic Preserve,Total Nitrogen,Bottom,Lab,501,501,0,0,29,0.210129700746323,6,0.0434751104992392,0,0,88,0.637634953988841
31,North Fork St. Lucie Aquatic Preserve,Total Nitrogen,Bottom,Lab,19,0,0,0,29,0.210129700746323,6,0.0434751104992392,0,0,88,0.637634953988841
33,Pellicer Creek Aquatic Preserve,Total Nitrogen,Bottom,Lab,25,0,0,0,29,0.210129700746323,6,0.0434751104992392,0,0,88,0.637634953988841
34,Pine Island Sound Aquatic Preserve,Total Nitrogen,Bottom,Lab,115,115,0,0,29,0.210129700746323,6,0.0434751104992392,0,0,88,0.637634953988841
35,Pinellas County Aquatic Preserve,Total Nitrogen,Bottom,Lab,86,86,0,0,29,0.210129700746323,6,0.0434751104992392,0,0,88,0.637634953988841
37,Rocky Bayou State Park Aquatic Preserve,Total Nitrogen,Bottom,Lab,1,0,0,0,29,0.210129700746323,6,0.0434751104992392,0,0,88,0.637634953988841
38,Rookery Bay Aquatic Preserve,Total Nitrogen,Bottom,Lab,8,0,0,0,29,0.210129700746323,6,0.0434751104992392,0,0,88,0.637634953988841
39,Rookery Bay National Estuarine Research Reserve,Total Nitrogen,Bottom,Lab,24,0,0,0,29,0.210129700746323,6,0.0434751104992392,0,0,88,0.637634953988841
12,Southeast Florida Coral Reef Ecosystem Conservation Area,Total Nitrogen,Bottom,Lab,134,0,0,0,29,0.210129700746323,6,0.0434751104992392,0,0,88,0.637634953988841
40,St. Andrews State Park Aquatic Preserve,Total Nitrogen,Bottom,Lab,1,0,0,0,29,0.210129700746323,6,0.0434751104992392,0,0,88,0.637634953988841
41,St. Joseph Bay Aquatic Preserve,Total Nitrogen,Bottom,Lab,40,40,0,0,29,0.210129700746323,6,0.0434751104992392,0,0,88,0.637634953988841
42,St. Joseph Bay State Buffer Preserve,Total Nitrogen,Bottom,Lab,1,0,0,0,29,0.210129700746323,6,0.0434751104992392,0,0,88,0.637634953988841
43,St. Martins Marsh Aquatic Preserve,Total Nitrogen,Bottom,Lab,168,168,0,0,29,0.210129700746323,6,0.0434751104992392,0,0,88,0.637634953988841
44,Terra Ceia Aquatic Preserve,Total Nitrogen,Bottom,Lab,38,0,0,0,29,0.210129700746323,6,0.0434751104992392,0,0,88,0.637634953988841
45,Tomoka Marsh Aquatic Preserve,Total Nitrogen,Bottom,Lab,85,85,0,0,29,0.210129700746323,6,0.0434751104992392,0,0,88,0.637634953988841
47,Yellow River Marsh Aquatic Preserve,Total Nitrogen,Bottom,Lab,1,0,0,0,29,0.210129700746323,6,0.0434751104992392,0,0,88,0.637634953988841
